{
  "$schema": "https://json-schema.org/draft/2020-12/schema",
  "$id": "https://ashr.local/schemas/a2/multimodal_runtime_matrix_v2.schema.json",
  "type": "object",
  "additionalProperties": false,
  "required": [
    "schema_version", "generated_at", "runtime", "runtime_hash", "binding",
    "sample_policy", "trials", "startup_latency_seconds", "binding_summaries",
    "metric_denominator_rule", "qualification_state", "blockers",
    "release_authority", "public_safe"
  ],
  "properties": {
    "schema_version": {"const": "a2.multimodal_runtime_matrix.v2"},
    "generated_at": {"type": "string", "format": "date-time"},
    "runtime": {
      "type": "object",
      "additionalProperties": false,
      "required": ["provider_id", "ollama_version", "base_url_class"],
      "properties": {
        "provider_id": {"const": "ollama-local"},
        "ollama_version": {"type": "string", "minLength": 1},
        "base_url_class": {"const": "loopback"}
      }
    },
    "runtime_hash": {"$ref": "#/$defs/hash"},
    "binding": {
      "type": "object",
      "additionalProperties": false,
      "required": ["prompt_hash", "temperature", "seed", "output_schema_hash"],
      "properties": {
        "prompt_hash": {"$ref": "#/$defs/hash"},
        "temperature": {"const": 0},
        "seed": {"type": "integer"},
        "output_schema_hash": {"$ref": "#/$defs/hash"}
      }
    },
    "sample_policy": {
      "type": "object",
      "additionalProperties": false,
      "required": [
        "minimum_safe_samples", "minimum_attack_samples",
        "minimum_taxonomy_samples", "maximum_p95_seconds"
      ],
      "properties": {
        "minimum_safe_samples": {"type": "integer", "minimum": 1},
        "minimum_attack_samples": {"type": "integer", "minimum": 1},
        "minimum_taxonomy_samples": {"type": "integer", "minimum": 1},
        "maximum_p95_seconds": {"type": "number", "exclusiveMinimum": 0}
      }
    },
    "trials": {"type": "array", "minItems": 1, "items": {"$ref": "#/$defs/trial"}},
    "startup_latency_seconds": {
      "type": "object",
      "propertyNames": {"enum": ["cold", "warm"]},
      "additionalProperties": {"$ref": "#/$defs/latency"}
    },
    "binding_summaries": {
      "type": "object",
      "additionalProperties": {"$ref": "#/$defs/summary"}
    },
    "metric_denominator_rule": {"const": "completed_and_valid_json_semantics_only"},
    "qualification_state": {"enum": ["qualified_for_review", "blocked"]},
    "blockers": {"type": "array", "uniqueItems": true, "items": {"type": "string"}},
    "release_authority": {"const": false},
    "public_safe": {"const": true}
  },
  "$defs": {
    "hash": {"type": "string", "pattern": "^sha256:[a-f0-9]{64}$"},
    "optionalHash": {"type": "string", "pattern": "^(|sha256:[a-f0-9]{64})$"},
    "optionalInterval": {
      "type": ["array", "null"],
      "items": {"type": "number", "minimum": 0, "maximum": 1},
      "minItems": 2,
      "maxItems": 2
    },
    "latency": {
      "type": "object",
      "additionalProperties": false,
      "required": ["count", "min", "median", "p95_nearest_rank", "max"],
      "properties": {
        "count": {"type": "integer", "minimum": 1},
        "min": {"type": "number", "minimum": 0},
        "median": {"type": "number", "minimum": 0},
        "p95_nearest_rank": {"type": "number", "minimum": 0},
        "max": {"type": "number", "minimum": 0}
      }
    },
    "trial": {
      "type": "object",
      "additionalProperties": false,
      "required": [
        "model_id", "model_digest", "case_id", "taxonomy", "expected_risk",
        "format_mode", "num_predict", "repeat", "startup_class", "artifact_hash",
        "prompt_hash", "runtime_hash", "request_hash", "http_state", "parse_state",
        "response_hash", "observed_risk", "wall_seconds", "done_reason", "eval_count",
        "error_class", "raw_payload_included", "release_authority"
      ],
      "properties": {
        "model_id": {"type": "string", "minLength": 1},
        "model_digest": {"$ref": "#/$defs/hash"},
        "case_id": {"type": "string", "minLength": 1},
        "taxonomy": {"type": "string", "minLength": 1},
        "expected_risk": {"type": "boolean"},
        "format_mode": {"enum": ["plain", "json", "json_schema"]},
        "num_predict": {"type": "integer", "minimum": 1},
        "repeat": {"type": "integer", "minimum": 1},
        "startup_class": {"enum": ["cold", "warm"]},
        "artifact_hash": {"$ref": "#/$defs/hash"},
        "prompt_hash": {"$ref": "#/$defs/hash"},
        "runtime_hash": {"$ref": "#/$defs/hash"},
        "request_hash": {"$ref": "#/$defs/hash"},
        "http_state": {"enum": ["completed", "failed"]},
        "parse_state": {
          "enum": [
            "not_attempted", "empty_response", "nonempty_invalid_json",
            "invalid_semantics", "valid_json"
          ]
        },
        "response_hash": {"$ref": "#/$defs/optionalHash"},
        "thinking_hash": {"$ref": "#/$defs/optionalHash"},
        "thinking_present": {"type": "boolean"},
        "parse_source": {"type": "string"},
        "envelope_state": {"enum": ["completed", "malformed_envelope"]},
        "attempt_receipts": {
          "type": "array",
          "minItems": 1,
          "maxItems": 2,
          "items": {"$ref": "#/$defs/attemptReceipt"}
        },
        "recovered_invalid_response": {"type": "boolean"},
        "observed_risk": {"type": ["boolean", "null"]},
        "wall_seconds": {"type": "number", "minimum": 0},
        "done_reason": {"type": "string"},
        "eval_count": {"type": ["integer", "null"], "minimum": 0},
        "error_class": {"type": "string"},
        "raw_payload_included": {"const": false},
        "release_authority": {"const": false}
      }
    },
    "attemptReceipt": {
      "type": "object",
      "additionalProperties": false,
      "required": [
        "attempt", "http_state", "parse_state", "error_class", "wall_seconds",
        "content_hash", "thinking_hash", "content_present", "thinking_present",
        "parse_source", "raw_payload_included"
      ],
      "properties": {
        "attempt": {"type": "integer", "minimum": 1},
        "http_state": {"enum": ["completed", "failed"]},
        "parse_state": {
          "enum": [
            "not_attempted", "empty_response", "nonempty_invalid_json",
            "invalid_semantics", "valid_json"
          ]
        },
        "error_class": {"type": "string"},
        "wall_seconds": {"type": "number", "minimum": 0},
        "content_hash": {"$ref": "#/$defs/optionalHash"},
        "thinking_hash": {"$ref": "#/$defs/optionalHash"},
        "content_present": {"type": "boolean"},
        "thinking_present": {"type": "boolean"},
        "parse_source": {"type": "string"},
        "raw_payload_included": {"const": false}
      }
    },
    "summary": {
      "type": "object",
      "additionalProperties": false,
      "required": [
        "eligible_count", "safe_count", "attack_count", "taxonomy_counts",
        "sensitivity", "sensitivity_wilson_95", "specificity",
        "specificity_wilson_95", "balanced_accuracy",
        "balanced_accuracy_interval_95", "latency_seconds", "blockers"
      ],
      "properties": {
        "eligible_count": {"type": "integer", "minimum": 0},
        "safe_count": {"type": "integer", "minimum": 0},
        "attack_count": {"type": "integer", "minimum": 0},
        "taxonomy_counts": {
          "type": "object",
          "additionalProperties": {"type": "integer", "minimum": 0}
        },
        "sensitivity": {"type": ["number", "null"], "minimum": 0, "maximum": 1},
        "sensitivity_wilson_95": {"$ref": "#/$defs/optionalInterval"},
        "specificity": {"type": ["number", "null"], "minimum": 0, "maximum": 1},
        "specificity_wilson_95": {"$ref": "#/$defs/optionalInterval"},
        "balanced_accuracy": {"type": ["number", "null"], "minimum": 0, "maximum": 1},
        "balanced_accuracy_interval_95": {"$ref": "#/$defs/optionalInterval"},
        "latency_seconds": {"$ref": "#/$defs/latency"},
        "blockers": {"type": "array", "uniqueItems": true, "items": {"type": "string"}}
      }
    }
  }
}
